{
  "$schema": "https://json-schema.org/draft/2020-12/schema",
  "title": "crumbkit/failure/v1",
  "description": "The document that a command prints on standard output when it fails with --json.",
  "type": "object",
  "properties": {
    "alternatives": {
      "description": "Other repairs the caller can try, in order of preference, each in the shape of recovery. It is present only when the failure offers at least one.",
      "type": "array",
      "items": {
        "description": "A repair the caller can try instead, tagged by kind.",
        "oneOf": [
          {
            "description": "Run this command.",
            "type": "object",
            "properties": {
              "call": {
                "type": "string"
              },
              "kind": {
                "const": "run"
              }
            },
            "required": [
              "kind",
              "call"
            ]
          },
          {
            "description": "Run the same command again later.",
            "type": "object",
            "properties": {
              "kind": {
                "const": "retry"
              }
            },
            "required": [
              "kind"
            ]
          },
          {
            "description": "Follow this advice.",
            "type": "object",
            "properties": {
              "kind": {
                "const": "hint"
              },
              "text": {
                "type": "string"
              }
            },
            "required": [
              "kind",
              "text"
            ]
          },
          {
            "description": "There is no next step, for this reason.",
            "type": "object",
            "properties": {
              "kind": {
                "const": "none"
              },
              "reason": {
                "type": "string"
              }
            },
            "required": [
              "kind",
              "reason"
            ]
          }
        ]
      }
    },
    "cause": {
      "description": "The errors that led to the failure, joined with \": \". It is present only when the failure has a cause.",
      "type": "string"
    },
    "code": {
      "description": "The failure's stable code in the tool's spelling, such as shelf::books::not_found. It is one or more printable ASCII characters without spaces, from ! to ~.",
      "type": "string",
      "pattern": "^[!-~]+$"
    },
    "fields": {
      "description": "The values at fault, in the order the failure gives them, each under a name of one or more lowercase ASCII letters, digits and underscores. A value is a string, an integer, a boolean, null, or an array or object of such values, and an object holds each key once. It is present only when the failure names at least one.",
      "type": "object",
      "additionalProperties": {
        "type": [
          "string",
          "integer",
          "boolean",
          "null",
          "array",
          "object"
        ],
        "$anchor": "field_value",
        "additionalProperties": {
          "$ref": "#field_value"
        },
        "items": {
          "$ref": "#field_value"
        }
      },
      "propertyNames": {
        "pattern": "^[a-z0-9_]+$"
      }
    },
    "labels": {
      "description": "The places in a source, such as a file, that the failure points at, in the order the failure gives them. It is present only when the failure has at least one label.",
      "type": "array",
      "items": {
        "type": "object",
        "properties": {
          "column": {
            "description": "The 1-based column of the start of the span, counted in characters of its line. It is present only when the span could be read.",
            "type": "integer",
            "minimum": 1
          },
          "excerpt": {
            "description": "The lines of the source that the span covers, with one line before and one after where the source has them. It is present only when the span could be read.",
            "type": "object",
            "properties": {
              "line": {
                "description": "The 1-based number of the first line of the excerpt.",
                "type": "integer",
                "minimum": 1
              },
              "text": {
                "description": "The lines, joined by the line breaks of the source, without a line break at the end.",
                "type": "string"
              }
            },
            "required": [
              "line",
              "text"
            ]
          },
          "length": {
            "description": "The length of the span in bytes.",
            "type": "integer",
            "minimum": 0
          },
          "line": {
            "description": "The 1-based line that holds the start of the span. It is present only when the span could be read.",
            "type": "integer",
            "minimum": 1
          },
          "name": {
            "description": "The name of the source, such as a file name. It is present only when the span could be read and the source has a name.",
            "type": "string"
          },
          "offset": {
            "description": "The byte offset of the start of the span from the start of the source.",
            "type": "integer",
            "minimum": 0
          },
          "text": {
            "description": "What the label says about the span. It is present only when the label has text.",
            "type": "string"
          }
        },
        "required": [
          "offset",
          "length"
        ]
      }
    },
    "message": {
      "description": "What went wrong.",
      "type": "string"
    },
    "recovery": {
      "description": "What the caller can do next, tagged by kind.",
      "oneOf": [
        {
          "description": "Run this command.",
          "type": "object",
          "properties": {
            "call": {
              "type": "string"
            },
            "kind": {
              "const": "run"
            }
          },
          "required": [
            "kind",
            "call"
          ]
        },
        {
          "description": "Run the same command again later.",
          "type": "object",
          "properties": {
            "kind": {
              "const": "retry"
            }
          },
          "required": [
            "kind"
          ]
        },
        {
          "description": "Follow this advice.",
          "type": "object",
          "properties": {
            "kind": {
              "const": "hint"
            },
            "text": {
              "type": "string"
            }
          },
          "required": [
            "kind",
            "text"
          ]
        },
        {
          "description": "There is no next step, for this reason.",
          "type": "object",
          "properties": {
            "kind": {
              "const": "none"
            },
            "reason": {
              "type": "string"
            }
          },
          "required": [
            "kind",
            "reason"
          ]
        }
      ]
    },
    "related": {
      "description": "The diagnostics that the failure's diagnostic relates to it, in the order it gives them. It is present only when there is at least one.",
      "type": "array",
      "items": {
        "type": "object",
        "properties": {
          "cause": {
            "description": "The errors below the related diagnostic, joined with \": \". It is present only when there is one.",
            "type": "string"
          },
          "code": {
            "description": "The related diagnostic's own code, which is free text. It is present only when the diagnostic has one.",
            "type": "string"
          },
          "help": {
            "description": "The related diagnostic's advice. It is present only when it gives some.",
            "type": "string"
          },
          "labels": {
            "description": "The places in a source, such as a file, that the failure points at, in the order the failure gives them. It is present only when the failure has at least one label.",
            "type": "array",
            "items": {
              "type": "object",
              "properties": {
                "column": {
                  "description": "The 1-based column of the start of the span, counted in characters of its line. It is present only when the span could be read.",
                  "type": "integer",
                  "minimum": 1
                },
                "excerpt": {
                  "description": "The lines of the source that the span covers, with one line before and one after where the source has them. It is present only when the span could be read.",
                  "type": "object",
                  "properties": {
                    "line": {
                      "description": "The 1-based number of the first line of the excerpt.",
                      "type": "integer",
                      "minimum": 1
                    },
                    "text": {
                      "description": "The lines, joined by the line breaks of the source, without a line break at the end.",
                      "type": "string"
                    }
                  },
                  "required": [
                    "line",
                    "text"
                  ]
                },
                "length": {
                  "description": "The length of the span in bytes.",
                  "type": "integer",
                  "minimum": 0
                },
                "line": {
                  "description": "The 1-based line that holds the start of the span. It is present only when the span could be read.",
                  "type": "integer",
                  "minimum": 1
                },
                "name": {
                  "description": "The name of the source, such as a file name. It is present only when the span could be read and the source has a name.",
                  "type": "string"
                },
                "offset": {
                  "description": "The byte offset of the start of the span from the start of the source.",
                  "type": "integer",
                  "minimum": 0
                },
                "text": {
                  "description": "What the label says about the span. It is present only when the label has text.",
                  "type": "string"
                }
              },
              "required": [
                "offset",
                "length"
              ]
            }
          },
          "message": {
            "description": "What the related diagnostic says.",
            "type": "string"
          },
          "related": {
            "description": "The diagnostics related to this one, in the same shape, to at most eight levels below the failure.",
            "type": "array",
            "items": {
              "$ref": "#related"
            }
          },
          "severity": {
            "description": "How severe the related diagnostic is. A diagnostic that gives no severity is an error.",
            "enum": [
              "error",
              "warning",
              "advice"
            ]
          },
          "url": {
            "description": "A page that explains the related diagnostic. It is present only when it has one.",
            "type": "string"
          }
        },
        "$anchor": "related",
        "required": [
          "message",
          "severity"
        ]
      }
    },
    "schema": {
      "description": "The id of this document.",
      "const": "crumbkit/failure/v1"
    },
    "url": {
      "description": "A page that explains the failure. It is present only when the failure has one.",
      "type": "string"
    }
  },
  "required": [
    "schema",
    "code",
    "message",
    "recovery"
  ]
}
